{
  "id": "2026-10-20-sol-baseline-setup",
  "title": "Non-Astra benchmark infrastructure baseline",
  "startedAt": "2026-10-20T20:38:33Z",
  "endedAt": "2026-10-20T22:32:28Z",
  "model": "gpt-5.6-sol",
  "provider": "openai-codex",
  "interface": "Hermes Desktop with Docker terminal backend",
  "reasoningMode": "not exposed by interface",
  "tools": ["terminal", "file", "web-search", "delegation"],
  "workPackage": "baseline",
  "inputAssets": ["primary-product"],
  "promptPath": "research/runs/2026-10-20-sol-baseline-setup/prompt.md",
  "outputPaths": [
    "research/protocol.md",
    "research/asset-candidates.md",
    "research/assets/upstream/CarConcept.glb",
    "public/assets/models/product.glb",
    "src/components/Configurator.tsx",
    "src/lib/threeViewer.ts"
  ],
  "provenance": {
    "lane": "mixed",
    "outputs": [
      { "path": "research/protocol.md", "lane": "non_astra_authored_baseline", "sourceAssets": ["primary-product"] },
      { "path": "research/asset-candidates.md", "lane": "non_astra_authored_baseline", "sourceAssets": ["primary-product"] },
      { "path": "research/assets/upstream/CarConcept.glb", "lane": "sourced_baseline", "sourceAssets": ["primary-product"] },
      { "path": "public/assets/models/product.glb", "lane": "non_astra_authored_baseline", "sourceAssets": ["primary-product"] },
      { "path": "src/components/Configurator.tsx", "lane": "non_astra_authored_baseline", "sourceAssets": ["primary-product"] },
      { "path": "src/lib/threeViewer.ts", "lane": "non_astra_authored_baseline", "sourceAssets": ["primary-product"] }
    ]
  },
  "elapsedSeconds": 6835,
  "cost": {
    "amount": null,
    "currency": "USD",
    "basis": "not exposed by interface"
  },
  "interventionLevel": 0,
  "outcome": "partial",
  "failureNotes": "This was intentionally excluded from Astra scoring. Blender was unavailable in the Docker backend and the host Astra session could not be invoked from inside the container.",
  "reviewer": "Hermes parent agent",
  "scores": {
    "provenance completeness": 3,
    "reproducibility": 3,
    "requirement completion": 2
  },
  "publicSummary": "Built the controlled research and web baseline under Sol; no output from this run is attributed to Astra."
}
